id,name,subtitle,start_setup,step_1,step_2,step_3
2107,Wall Pushes,Isometric exertion that completes the stress activation cycle,Standing an arm's length from a solid wall.,"[A] Hands on Wall at Shoulder Height (SETUP) Place both palms flat against the wall at shoulder height, arms nearly straight. Step the feet back slightly. The stress response contracts muscles and primes them for exertion — this exercise uses that primed energy deliberately rather than letting it sit unspent in the body.","[B] Push with Maximum Effort (EXERT) Press into the wall as hard as you can — as if you intend to push it over. Engage the entire kinetic chain: push through the feet, brace the core, press with the chest, shoulders, and arms simultaneously. Hold 10 seconds of maximal effort. Breathe out slowly during the push.","[C] Release and Exhale Fully (COMPLETE) Release suddenly and exhale completely. The abrupt shift from maximum tension to release signals the nervous system that the threat response is complete. Repeat 3–5 times. This is the physical completion of the fight-or-flight cycle — the body gets the exertion it was primed to perform, and can now down-regulate."
2108,Butterfly Hug,Bilateral stimulation (EMDR technique) that integrates the stress response,"Seated or standing, arms crossed over the chest.","[A] Cross Arms Over Chest (SETUP) Cross both arms over the chest — right hand to the left shoulder area, left hand to the right — like hugging yourself. Fingertips rest near the collarbones or upper arms. Close the eyes. This position was developed by Lucina Artigas for trauma survivors and is a core technique in EMDR (Eye Movement Desensitization and Reprocessing) therapy.","[B] Alternating Taps (BILATERAL) Begin alternating gentle taps — right hand taps, then left hand taps — at a slow, rhythmic pace, like a slow heartbeat. The alternating bilateral stimulation mimics REM sleep processing and activates both brain hemispheres simultaneously. This helps the nervous system integrate and file the stress experience rather than holding it.","[C] Continue and Breathe (INTEGRATE) Continue for the full 90 seconds. Breathe slowly and naturally. You may notice images, sensations, or memories arising — let them pass without engagement. The bilateral rhythm is doing the work. Many people find this position produces an immediate sense of comfort and safety — the same circuits activated by human contact are recruited through self-administered bilateral touch."
2201,Wall-Press TKE (Terminal Knee Extension),Quad activation without compression,"Standing, facing a wall with one foot slightly behind the other. The front knee is slightly bent.",[A] Wall Setup (SETUP) Stand facing a wall. Place one foot slightly behind the other. The front knee is slightly bent. Keep the front heel grounded.,[B] Press & Lock Out (ACTIVATE) Press the front heel into the floor and squeeze the quadriceps hard to 'lock out' the knee. Hold the squeeze for 2 seconds.,[C] Release & Repeat (CONTROL) Release and repeat 10–12 times per leg. Switch sides.
2202,Straight Leg Raises,Quad strength without joint load,"Lying on your back: one leg bent with foot flat, the other leg straight out.","[A] Supine Setup (SETUP) Lie on your back. One leg bent, foot flat; the other leg extended straight.",[B] Lift to Opposite Knee Height (STRENGTHEN) Lift the straight leg to the height of the opposite bent knee. Squeeze the quad at the top. Lower slowly.,[C] Controlled Lower (ECCENTRIC) Lower in 3 seconds. 10–12 reps per leg.
2203,Isometric Wall Sits,Pain-numbing isometric hold,"Standing: back flat against a wall, feet shoulder-width apart and 12 inches forward.","[A] Wall Contact (SETUP) Stand with back flat against a wall. Feet shoulder-width, about 12 inches in front.",[B] Slide Down (HOLD) Slide down into a partial squat. Hold. Isometric holds have a pain-numbing effect on joints.,[C] Breathe (RELEASE) Hold 45 seconds. Breathe normally.
2204,Towel Heel Slides,Joint oiling for arthritis stiffness,Lying on your back: one heel resting on a towel or smooth surface.,"[A] Supine, Heel on Towel (SETUP) Lie on your back. One heel on a towel or smooth floor.","[B] Slide Heel Toward Glutes (MOBILIZE) Slowly slide the heel toward your glutes, then back out. Joint oiling for stiffness.",[C] Smooth & Slow (REPEAT) Continue 45 seconds. Repeat other side if time allows.
2205,Self-Resisted Clamshells,Hip strength to prevent knee cave,Lying on your side: knees bent at 90 degrees and stacked. Top hand on outside of top knee.,"[A] Side-Lying Setup (SETUP) Lie on your side. Knees bent 90°, stacked. Top hand on outside of top knee.",[B] Lift Against Resistance (STRENGTHEN) Lift the top knee while pressing down with your hand. Stronger hips prevent the knee from caving inward.,[C] Lower & Repeat (CONTROL) Lower slowly. 10–12 reps per side.
2206,Seated Knee Extensions,Thigh strength without weight-bearing,Seated: sitting tall in a chair with feet dangling.,"[A] Chair Setup (SETUP) Sit tall in a chair, feet dangling. Hands on chair or thighs.",[B] Straighten Leg (EXTEND) Slowly straighten one leg until horizontal. Squeeze the quad at the top. Maintains thigh muscle mass when weight-bearing is painful.,[C] Lower Slowly (CONTROL) Lower in 3 seconds. 10–12 reps per leg.
2207,Low Box Step-Ups,"Eccentric strength, slow descent",Standing: facing a low step or the bottom stair.,[A] Step Setup (SETUP) Stand facing a low step or bottom stair. 4–6 inches is enough to start.,[B] Step Up (CONCENTRIC) Step up slowly with one foot. Bring the other foot to meet it.,[C] Slow Descent (ECCENTRIC) Step down slowly — 3–4 seconds to lower. Builds eccentric strength that protects the knee. 8–10 reps each leg.
3001,Standing Club Rotations,Separate upper body rotation from stable hips.,Standing tall with feet shoulder-width apart.,"(SETUP) Hold a golf club across your upper back and shoulders, gripping each end. Keep your spine straight and knees slightly bent.",(ROTATE) Rotate your torso to the right as far as comfortable while keeping your hips and feet facing forward.,"(SWITCH) Slowly rotate to the left, feeling the separation between your upper and lower body."
3002,Leg Swings,"Lubricate the hip joint in front, back, and lateral planes.",Standing near a wall or golf cart for balance.,"(SETUP) Stand on one leg, engage your core, and rest a hand lightly on the wall or cart for balance.","(SWING) Swing the opposite leg forward and backward in a controlled motion, gradually increasing the range as the hip warms up.",(LATERAL) Switch to side-to-side swings in front of your body to open the hip socket in the lateral plane.
3003,Active Wrist Circles,Warm wrists and forearms for gripping the club.,Arms extended in front of you at chest height.,(SETUP) Make light fists with both hands with arms extended at shoulder height.,"(CIRCLE) Rotate your wrists in slow, controlled clockwise circles, using the full available range.","(REVERSE) Change direction to counter-clockwise, releasing tension through the forearms."
3004,Open Books,Restore thoracic rotation after repetitive swings.,"Lying on your side, knees stacked and bent at 90 degrees.",(SPINE) Extend both arms straight out in front of you with palms touching and knees stacked.,(OPEN) Lift the top arm and rotate it slowly across your body toward the floor behind you while keeping your knees pinned together.,"(RESET) Breathe deeply into the stretch, then slowly return to the starting position and repeat."
3005,Kneeling Hip Flexor Stretch,Lengthen the front of the hip after walking and swinging.,In a half-kneeling position with one knee on the floor.,"(SETUP) Keep your front foot flat, torso upright, and ribs stacked over the pelvis.",(TUCK) Gently tuck your pelvis under and lean forward slightly until you feel a stretch in the front of your back hip.,(REACH) Reach the arm on the same side as your back knee toward the ceiling to deepen the release.
3006,Thread the Needle,Release tension between the shoulder blades.,On all fours with hands under shoulders and knees under hips.,"(SETUP) Slide one arm underneath the other, palm up, reaching as far as comfortable.","(ROTATE) Lower your shoulder and ear toward the floor, letting the upper back rotate.",(BREATH) Hold and breathe into the space between your shoulder blades before switching sides.
3011,Lateral Lunges with Reach,Groove lateral load and balance for wide court coverage.,Standing with feet wide apart.,"(SETUP) Shift your weight to the right, bending the right knee while keeping the left leg straight.",(REACH) Reach your arms forward to balance your weight and keep the chest lifted.,"(SWITCH) Push off the right foot to return to center, then repeat on the left side."
3012,Shoulder Y & T Raises,Activate lower traps and posterior shoulder for overhead work.,Standing with a slight hinge at the hips.,(SETUP) Let your arms hang down with thumbs pointing out and spine long.,"(Y-RAISE) Raise your arms up to form a Y shape, squeezing the shoulder blades together.","(T-RAISE) Lower your arms, then raise them straight out to the sides to form a T, maintaining control."
3013,Ankle Hops,Prime calf and Achilles for quick first steps.,Standing tall with feet close together.,(SETUP) Stay light on the balls of your feet with knees slightly soft.,"(HOP) Perform small, quick vertical hops, focusing on a fast bounce off the ground.",(STABILITY) Keep your core tight and land softly each time without letting the heels slam down.
3014,Forearm Extensor Release,Unload the outer elbow and backhand tissues.,Arm extended straight in front of you.,(SETUP) Point your fingers toward the floor with the palm facing you.,(STRETCH) Use the opposite hand to gently pull the back of your hand toward your body until you feel a stretch.,"(RELEASE) Hold for several breaths, then ease off and switch sides."
3015,Figure-4 Glute Stretch,Open the hips after repeated lunges and changes of direction.,Lying on your back with knees bent.,(SETUP) Cross your right ankle over your left knee to create a figure-4 shape.,"(PULL) Reach through and grab your left thigh, gently pulling it toward your chest.","(SWITCH) Hold for several breaths, then repeat on the opposite side."
3016,Child's Pose with Side Reach,Lengthen lats and side body after serving and overheads.,"Kneeling on the floor, sitting back on your heels.",(SETUP) Fold forward and rest your forehead on the floor with arms extended in front of you.,(REACH) Walk both hands to the right until you feel a stretch along your left side and lat.,"(SWITCH) Walk hands back to center, then over to the left side and repeat."
3021,Ankle Circles,Mobilize the ankles before the miles.,"Standing tall, using a wall for balance if needed.",(SETUP) Lift one foot off the ground while lightly supporting yourself on the wall if needed.,"(CIRCLE) Rotate the ankle in slow, controlled clockwise circles.","(REVERSE) Switch to counter-clockwise circles, then repeat with the other foot."
3022,Glute Activation Drive,Fire the glutes to support the pelvis with each step.,Standing with feet hip-width apart.,(SETUP) Shift weight to your left leg and engage your core.,(DRIVE) Lift the right knee toward your chest while squeezing the left glute.,"(SWITCH) Lower the foot with control and repeat on the other side, staying tall."
3023,Controlled Arm Swings,Rehearse efficient arm swing for walking.,Standing tall with shoulders relaxed.,(SETUP) Bend your elbows slightly and let the arms hang by your sides.,(SWING) Swing your arms forward and backward from the shoulder joint in a natural rhythm.,(RELAX) Keep your neck long and avoid shrugging the shoulders as you move.
3024,Calf Release,Lengthen the calf and Achilles after long walks.,Standing facing a wall.,(SETUP) Place both hands on the wall and step one foot back.,(PRESS) Keep the back heel on the floor and lean into the wall until you feel a stretch in the calf.,"(BEND) Slightly bend the back knee to target the lower calf and Achilles, then switch sides."
3025,Standing Quad Stretch,Open the front of the thigh after steady forward motion.,"Standing tall, holding a chair for balance.",(SETUP) Reach back and grab your right ankle or foot.,(ALIGN) Pull the heel toward your glute while keeping your knees together and torso upright.,"(SWITCH) Hold the stretch, then repeat on the left side."
3026,Foot Arch Massage,Reset the arches after time on your feet.,Standing or seated.,(SETUP) Place a small ball or firm object under the arch of your foot.,(ROLL) Apply gentle pressure and roll the foot forward and backward over the object.,(FOCUS) Spend extra time on any tight or tender spots before switching feet.
3031,Pogo Hops,Wake up calf and Achilles for impact.,Standing with feet hip-width apart.,(SETUP) Keep your knees almost straight and stand tall.,"(BOUNCE) Jump using only your ankles and calves, staying on the balls of your feet.","(RHYTHM) Maintain a quick, rhythmic pace to prime the tendons."
3032,Runner's Lunge with Reach,Open hip flexors and side body before the run.,Standing tall.,"(SETUP) Step back into a lunge, keeping the back leg straight and front knee stacked over the ankle.",(REACH) Reach both arms toward the ceiling and tilt your torso slightly away from the back leg.,(SWITCH) Return to standing and switch sides with control.
3033,Hamstring Scoops,Lengthen the hamstrings and groove front-leg loading.,Standing with one heel forward and toes pointed up.,(SETUP) Hinge at the hips while keeping the front leg straight and back knee soft.,"(SCOOP) Reach down and scoop your hands toward the floor in front of the foot, then up overhead.",(SWITCH) Take a small step forward and repeat on the other leg.
3034,Seated Figure-4,Decompress the hips after repetitive strides.,Seated on the floor with legs extended.,(SETUP) Bend your left knee and cross your right ankle over the left thigh.,(PRESS) Lean forward slightly or pull the left thigh toward you to feel the stretch in the right hip.,"(SWITCH) Hold, then repeat on the opposite side."
3035,Cobra Pose,Restore extension through the front of the body.,Lying face down on a mat.,(SETUP) Place your hands on the floor next to your shoulders with elbows close to your sides.,"(LIFT) Gently press through your hands to lift your chest off the floor, keeping your hips grounded.",(EXTEND) Draw shoulders away from your ears and breathe into the front of the body.
3036,Legs Up the Wall,Assist circulation and recovery after impact.,Lying on your back with your glutes as close to a wall as possible.,(SETUP) Extend your legs straight up against the wall with heels resting lightly.,(RELAX) Let your arms rest by your sides with palms up and jaw unclenched.,"(BREATHE) Stay here for about two minutes, breathing slowly to calm the system."