id,name,subtitle,start_setup,step_1,step_2,step_3
1,Cat–Cow,Segmental Spinal Flexion/Extension,"On all fours — hands under shoulders, knees under hips.","[A] Neutral Tabletop (SPINE) Hands under shoulders, knees under hips. Spine flat and parallel to floor. Neck long.","[B] Cat — Exhale (FLEX) Round spine toward ceiling. Tuck chin to chest, tuck pelvis under. Breathe out fully.",[C] Cow — Inhale (EXT) Let belly drop toward floor. Lift gaze and tailbone gently. Do not compress the lower back.
2,Sphinx Pose,Low Prone Back Extension,Lying face down on the floor.,"[A] Prone Start (SETUP) Lie face down. Legs long, tops of feet flat. Elbows directly under shoulders.",[B] Lift (EXT) Press forearms into floor. Lift chest and head. Shoulders away from ears. Hold 5–10s.,
3,Child's Pose,Rest & lengthen spine,"Kneeling on the floor, sitting back toward your heels.","[A] Kneel Upright (SETUP) Kneel with big toes together, knees hip-width apart. Sit back toward heels.","[B] Fold Forward (STRETCH) Walk hands forward, forehead to floor. Arms extended or alongside body. Breathe into the back.",
4,Arm Circles,Fwd & Bwd · Small to Large,"Standing, feet hip-width apart.","[A] Stand Tall (SETUP) Feet hip-width. Arms extended at sides at shoulder height. Thumbs up, palms face forward.",[B] Forward Circles (FORWARD) Start small — wrist-sized circles moving forward. Gradually increase to full arm sweeps. Keep shoulders down and relaxed. 10 reps.,[C] Backward Circles (BACKWARD) Reverse direction. Same progression — small to large. Squeeze shoulder blades slightly on the back swing. 10 reps.
5,Pelvic Tilts,Supine Posterior/Anterior Tilt,"Lying on your back, knees bent, feet flat on the floor.",[A] Supine Neutral (SETUP) Small natural arch in lower back. Arms at sides.,[B] Posterior Tilt (CORE) Gently press lower back into floor. Engage deep abdominals. Hold 2s. Do not hold breath.,[C] Anterior Tilt (RELEASE) Let the lower back arch slightly away from the floor as the pelvis tips forward. Then gently press the lower back into the floor again. Move slowly back and forth between the small arch and the gentle press.
6,Glute Bridge,Bodyweight,"Lying on your back, knees bent, feet flat on the floor.","[A] Supine Setup (SETUP) Feet flat, hip-width, heels 6 inches from glutes. Arms flat at sides.","[B] Bridge Up (GLUTES) Drive through heels. Lift hips until shoulders, hips, knees form a straight line. Squeeze glutes at top.",
7,Marching Bridge,Keep hips level,Lying on your back with hips lifted in a glute bridge.,[A] Hold Bridge (SETUP) Perform a full Glute Bridge and hold at the top. Engage core. Do not let hips drop.,"[B] Lift One Foot (STABILITY) Slowly lift one foot off floor, knee to 90°. Hips stay perfectly level. Hold 2s.","[C] Alternate (CONTROL) Lower foot, repeat other side. Think of balancing a glass of water on each hip."
8,Dead Bug,Contralateral Arm/Leg,"Lying on your back, arms reaching toward the ceiling.",[A] Supine Tabletop (SETUP) Arms reach to ceiling. Hips and knees at 90°. Press lower back firmly into floor.,[B] Extend Opposite Limbs (CORE) Slowly lower right arm overhead and extend left leg toward floor. Keep back flat. Exhale throughout.,[C] Return & Switch (CONTROL) Return to tabletop position. Repeat with left arm and right leg. Move in 4-second counts each way.
9,Bird Dog,Paused Extension,"On all fours — hands under shoulders, knees under hips.","[A] Neutral Tabletop (SETUP) Hands under shoulders, knees under hips. Spine neutral. Brace core lightly before moving.","[B] Extend & Pause (STABILITY) Reach right arm forward, left leg back. Both parallel to floor. Pause 2–3s. Do not rotate hips.",[C] Return Controlled (CONTROL) Draw elbow to knee beneath the body (optional crunch). Reset to neutral. Switch sides.
10,High Plank,"Core tight, body straight","Facing down, hands flat on the floor, body in a straight line.","[A] Hand Position (SETUP) Hands flat, shoulder-width. Fingers spread. Wrists stacked under shoulders.",[B] Full Plank (HOLD) Body forms one straight line: head to heels. Squeeze glutes. Pull navel toward spine. Breathe.,
11,Wall Push-Ups,Controlled tempo,Standing an arm's length from a wall.,[A] Wall Setup (SETUP) Stand arm's length from wall. Hands flat at shoulder height and width. Body straight.,"[B] Lower (ECCENTRIC) Bend elbows, lower chest toward wall. Take 2–3 seconds. Keep body rigid, no sagging hips.",[C] Press Back (PUSH) Push through palms to return to start. Fully extend arms. 1-second pause at top.
12,Isometric Wall Push Hold,Halfway down position,Standing an arm's length from a wall.,"[A] Wall Setup (SETUP) Same as Wall Push-Up starting position. Body straight, hands at shoulder height.",[B] Halfway Hold (ISO) Lower to the midpoint — elbows at roughly 90°. Hold completely still. Do not let arms drift further.,
13,Resistance Band Row,"Elbows pull back, chest relaxed","Standing, band anchored at chest height in front of you.","[A] Band Setup (SETUP) Anchor band at chest height. Stand tall, holding one end in each hand. Slight tension at arm's length.","[B] Row Back (PULL) Drive elbows straight back, hugging ribs. Shoulder blades squeeze together. Pause 1s at chest.",[C] Controlled Return (RELEASE) Extend arms slowly — 2–3 seconds. Do not let shoulders roll forward at full extension.
14,Wall Angels,Or Floor Angels,Standing with your back flat against a wall.,"[A] Wall Contact (SETUP) Stand with back, head, and glutes against wall. Arms bent at 90°, backs of hands touching wall.","[B] Slide Up (RAISE) Slowly slide arms upward, maintaining contact with wall at all times. Go only as far as contact allows.","[C] Slide Down (LOWER) Return to start position in 3s. If wall contact is lost, reduce range. Quality over range."
15,Supine Hamstring Stretch,Straight-Leg Raise,"Lying on your back, both legs extended. You'll do one leg at a time (e.g. right first, then left).","[A] Supine Start (SETUP) Lie on your back. Both legs extended, lower back neutral. Arms relaxed at your sides.","[B] Raise One Leg (STRETCH) Lift one leg (e.g. right first) keeping the knee straight. Use both hands to hold behind the thigh or calf. Feel the stretch in the hamstring, not the knee. Switch to the other leg when cued.",
16,Figure Four Stretch,Supine Piriformis Stretch,"Lying on your back, knees bent, feet flat. Cross one ankle over the opposite knee (e.g. right ankle over left knee); you'll do both sides.","[A] Cross Leg Over Knee (SETUP) Lie on your back, knees bent, feet flat. Cross one leg over the other by placing that ankle on the opposite knee (e.g. right ankle on left knee). Flex the foot of the crossed leg.",[B] Draw In (STRETCH) Clasp hands behind the supporting thigh (the one with the foot on the floor) and gently draw both legs toward your chest. Feel the stretch in the outer hip of the crossed leg. Repeat on the other side when cued.,
17,Windshield Wipers,Supine Hip Rotation,"Lying on your back, knees bent, arms out in a T. Rotate knees side to side.","[A] Supine, Feet Flat (SETUP) Lie on your back. Knees bent, feet flat and hip-width. Arms out in a T, palms down for stability.",[B] Lower Knees Right (ROTATE) Let both knees fall slowly to the right toward the floor. Keep shoulders flat. Breathe out.,"[C] Lower Knees Left (ROTATE) Sweep knees back through center and lower to the left. Move at a slow, windshield-wiper pace. Continue alternating as needed."
18,Reclined Spinal Twist,Arms in T position,"Lying on your back, one knee drawn to your chest. Do one side (e.g. right) then the other.","[A] Supine Start (SETUP) Lie on your back. Draw one knee to your chest (e.g. right first). Arms out in a T, shoulders heavy on the floor.",[B] Cross & Hold (TWIST) Guide that knee across your body with the opposite hand (e.g. right knee to the left with left hand). Turn gaze the other way if comfortable. Hold 20–30s. Repeat on the other side when cued.,
19,Seated Forward Fold,Relaxed Spine,"Seated on the floor, legs extended in front of you.",[A] Seated Tall (SETUP) Sit with legs extended or slightly bent. Spine long. Hands on thighs. Breathe in.,"[B] Fold Forward (RELEASE) Hinge at hips, walk hands toward feet. Let spine round naturally. Head heavy. Hold 30–60s.",
20,Chin Tucks,Cervical Retractions,"Seated or standing upright, eyes level with the horizon.",[A] Neutral Head (SETUP) Sit or stand tall. Eyes level with horizon. Shoulders relaxed. No tension in jaw.,[B] Retract (CERVICAL) Draw chin straight back — not down. Create a slight double chin. Hold 2s. Feel a gentle stretch at base of skull.,
21,Neck Half-Circles,Controlled Tilts,"Seated upright, shoulders relaxed, eyes forward.","[A] Neutral Start (SETUP) Sit tall, shoulders relaxed. Eyes forward. Do not perform full circles — avoid rolling the head back.",[B] Right Tilt (LATERAL) Drop right ear toward right shoulder. Keep left shoulder down. Hold 3s. Return through center.,[C] Left Tilt (LATERAL) Drop left ear toward left shoulder. Smooth arc only from ear to ear through chin. Never through the back.
101,Lymph Hops,Gentle rebounding to stimulate circulation,"Standing, feet hip-width apart, knees soft.","[A] Soft Stand (SETUP) Feet hip-width. Knees soft, never locked. Arms relaxed at sides. Jaw loose. Breathe naturally.","[B] Micro Bounce (CIRCULATE) Rise gently onto the balls of your feet and let your heels drop back down. Barely leave the ground. Think: soft vibration, not jumps.",[C] Rhythm (FLOW) Find a relaxed 1–2 beat. Let arms dangle and bounce passively. Face and shoulders stay completely soft. This should feel effortless.
102,Body Waves,"Spinal undulation, head to tailbone","Standing, feet hip-width, knees slightly bent.","[A] Stand Loose (SETUP) Feet hip-width, knees slightly bent. Arms at sides. Imagine your spine is a string of loose beads.","[B] Initiate Wave (MOBILIZE) Begin the wave at the top: let your head nod gently forward, then ripple the movement down through neck, chest, belly.","[C] Full Undulation (FLOW) As the wave reaches the pelvis, let it curl forward then rise back up. Continuous, fluid figure-8. No forcing — gravity does the work."
103,Arm Swings,"Pendulum swings, shoulders passive","Standing, feet slightly wider than hips, arms relaxed.",[A] Loose Stance (SETUP) Feet slightly wider than hips. Knees soft. Let arms hang completely relaxed from the shoulders.,"[B] Initiate Swing (MOMENTUM) Turn torso gently left — arms swing right passively, carried by momentum. Do not muscle the arms. They follow the body.",[C] Continuous Turn (FLOW) Turn right — arms swing left. Find a pendulum rhythm. Arms may tap your sides lightly. Increase range gradually as you warm up.
104,Trunk Twists,"Rotational swing, arms passive","Standing, feet shoulder-width apart, arms loose at sides.","[A] Loose Stance (SETUP) Feet shoulder-width, knees soft. Arms hang at sides. Spine tall but not stiff.","[B] Twist Right (ROTATE) Rotate torso to the right. Arms swing passively — left arm wraps across the front, right swings behind. Pivot on left ball of foot.","[C] Twist Left (ROTATE) Swing back through center and rotate left. Right arm wraps front, left swings behind. Find a loose, rhythmic pendulum pace."
105,Ballet Squats,"Wide stance pliés, toes turned out","Standing, feet wide, toes turned outward.","[A] Wide Stance (SETUP) Feet wider than hips, toes turned out to roughly 10 and 2 o'clock. Arms out at sides or hands at heart center.","[B] Plié Down (LOWER) Bend knees, tracking them over toes. Lower slowly — 3 seconds down. Keep torso upright, tailbone dropping straight down.",[C] Rise Up (LIFT) Press through the full foot to return to standing — 2 seconds up. Gently squeeze inner thighs at the top. Do not lock knees.
106,Tip Toe Arm Swings,Rising onto toes with overhead reach,"Standing, feet hip-width apart.",[A] Flat Foot (SETUP) Feet hip-width. Arms relaxed at sides. Soft knees. This is the low point of the movement.,[B] Rise & Reach (LIFT) Rise onto tiptoes as arms sweep upward and forward to shoulder height or overhead. Inhale on the rise.,[C] Lower & Swing (DRAIN) Lower heels as arms swing back down and behind. Exhale. The arm swing is passive — gravity-assisted. Continuous and flowing.
107,Doorway Pec Stretch,"Chest opening, shoulder mobility","Standing in a doorway, arms at 90° on the frame.","[A] Doorway Position (SETUP) Stand in a doorway. Place both forearms on the frame at 90° — elbows at shoulder height, upper arms parallel to floor.",[B] Step Through (STRETCH) Step one foot forward through the doorway. Let your body lean gently into the opening. Feel the chest and front shoulders open.,"[C] Hold & Breathe (RELEASE) Hold without forcing. Take 3 slow, deep breaths — each exhale, let the chest open a little more. Do not shrug shoulders."
108,Forward / Backward Arm Circles,"Full shoulder rotation, both directions","Standing, feet hip-width apart.",[A] Stand Tall (SETUP) Feet hip-width. Arms at sides. Shoulders relaxed down. Begin with small circles and gradually increase the range.,[B] Forward Circles (MOBILIZE) Both arms circle forward simultaneously — 15 slow rotations. Feel the shoulder joint moving through its full range.,[C] Backward Circles (MOBILIZE) Reverse direction — 15 slow rotations backward. Backward circles open the chest and counteract forward shoulder posture.
109,Dead Arms,Passive shoulder release,"Standing, hinged slightly forward at the hips.",[A] Slight Forward Lean (SETUP) Hinge slightly at the hips. Let both arms hang completely dead — no muscle engagement. Jaw loose.,[B] Gentle Sway (RELEASE) Let the arms sway passively as you shift your weight side to side. Do not initiate any movement with the shoulder muscles. Gravity only.,"[C] Small Circles (DECOMPRESS) Let the arms trace small passive circles — clockwise, then counter-clockwise. This gently tractions the shoulder joints."
110,Bent Over Back Shakes,"Spinal decompression, gravity assist","Standing, bent forward at the hips, upper body hanging down.","[A] Hinge Forward (SETUP) Hinge at the hips, knees soft. Let the upper body hang forward — arms dangling, head heavy. Let gravity decompress the spine.","[B] Gentle Shake (RELEASE) Softly shake the upper body — small, effortless oscillations. Let the spine wobble freely. This releases the erectors and multifidus.",[C] Side Sway (MOBILIZE) Add a gentle side-to-side sway. Let the arms swing. Stay loose. This is pure release — nothing to engage.
111,Golf Swings,Full rotation with follow-through,"Standing, feet shoulder-width, slight forward hinge at hips.",[A] Address Position (SETUP) Feet shoulder-width. Slight hip hinge. Arms hang loose. Imagine holding a club — but keep the grip soft.,"[B] Backswing (ROTATE) Rotate through the hips and torso to the right, letting the arms follow passively. Left heel can lift slightly. No forcing.",[C] Through Swing (RELEASE) Swing through to the left in one fluid motion. Arms follow the torso — do not lead with the arms. Alternate sides for 1 minute.
112,Twist the Waist,"Isolated hip rotation, upper body still","Standing, feet hip-width, hands on hips.",[A] Stand Tall (SETUP) Feet hip-width. Hands on hips. Eyes forward. Upper body completely still throughout — only the hips move.,"[B] Hip Rotation (ISOLATE) Rotate the pelvis to the right, then sweep left in a continuous figure-8 or side-to-side motion. Upper body stays square.",[C] Find Rhythm (MOBILIZE) Increase the range gradually. Feel the lumbar spine rotating freely. This is the movement that desk work robs you of most.
113,March Taps,"Alternating knee lifts, arms opposite","Standing upright, shoulders relaxed.",[A] Upright Stance (SETUP) Stand tall. Shoulders relaxed. This is a gentle march — not a high-knee drill. Pace is easy and rhythmic.,"[B] Lift & Tap (CIRCULATE) Lift right knee to comfortable height, tap with left hand. Lower. Lift left knee, tap with right hand. Alternate continuously.",[C] Add Arm Swing (FLOW) Let the opposite arm swing naturally with each step — just like walking. This cross-body pattern activates lymphatic flow bilaterally.
114,Wide Arm Step Backs,Lateral step with full arm opening,"Standing, feet together, arms at sides.","[A] Neutral Start (SETUP) Feet together, arms at sides. Soft knees. This movement is slow and deliberate — not aerobic.",[B] Step & Open (EXPAND) Step right foot back and wide as both arms sweep out to the sides and overhead — like opening a large book. Inhale.,"[C] Return & Close (FLOW) Step feet back together, arms return to sides. Exhale. Alternate sides. The arm sweep opens the chest and axillary lymph nodes."
115,Wall Pushups,"Upper body close, standing",Standing an arm's length from a wall.,"[A] Hands on Wall (SETUP) Stand an arm's length from the wall. Place hands at shoulder height, slightly wider than shoulder-width. Body in a straight line.",[B] Lower In (PUSH) Bend elbows and lean chest toward the wall. Keep the body rigid — no sagging hips. Elbows track at roughly 45° from the torso.,[C] Press Out (EXTEND) Push back to start. Exhale on the push. Move slowly and with control. This is not about speed — it's about reactivating the chest and shoulders.
201,Supine Knee Hugs,Gentle lumbar decompression,"Lying on your back, legs extended.",[A] Flat on Back (SETUP) Lie on your back. Let the body be completely heavy. Take two slow breaths before moving.,[B] Hug Both Knees (DECOMPRESS) Draw both knees to chest. Wrap arms around shins. Rock gently side to side 5–8 times. Release lower back.,
202,Supine Twist,"Both sides, 30s each","Lying on your back, knees bent and together.","[A] Knees to Chest (SETUP) Lie on back, knees bent and together. Arms out in a T. Shoulders heavy.",[B] Drop Right (ROTATE) Let both knees fall to the right. Turn gaze left if comfortable. Breathe and let gravity do the work for 30 seconds.,"[C] Drop Left (ROTATE) Return knees through center, drop left. Hold another 30 seconds. No forcing — just releasing."
203,Cat–Cow,Segmental spinal warm-up,"On all fours — hands under shoulders, knees under hips.","[A] Neutral Tabletop (SETUP) Hands under shoulders, knees under hips. Spine flat. Take one breath here before moving.","[B] Cat (FLEX) Round spine to ceiling, tuck pelvis and chin. Full exhale.","[C] Cow (EXT) Let belly drop, lift gaze and tailbone gently. Full inhale. 8–10 slow cycles."
204,Standing Hip Circles,"Hands on hips, full rotation","Standing, feet hip-width, hands on hips.",[A] Stand Tall (SETUP) Feet hip-width. Hands on hips. Soft knees. Eyes forward or closed.,"[B] Circle Right (MOBILIZE) Make slow, large circles with the pelvis — forward, right, back, left. 6 circles clockwise.",[C] Circle Left (MOBILIZE) Reverse direction. 6 circles counter-clockwise. Let the hips move freely without rushing.
205,Shoulder Rolls,"Forward then backward, slow","Standing or seated upright, arms relaxed at sides.",[A] Arms at Sides (SETUP) Stand or sit tall. Arms completely relaxed. Jaw soft.,"[B] Roll Forward (ANTERIOR) Shrug shoulders up toward ears, then roll them forward and down. 6 slow rolls.","[C] Roll Back (POSTERIOR) Reverse — shrug up, roll back and down. 6 rolls. Feel the shoulder blades move and the chest open."
206,Sun Breath,"Arms overhead with breath, 6 cycles","Standing, feet hip-width, arms at sides.",[A] Stand Grounded (SETUP) Feet hip-width. Arms at sides. Close the eyes. Feel the weight of the body through the soles of the feet.,[B] Inhale & Rise (EXPAND) Breathe in slowly for 4 counts as arms sweep out to the sides and overhead. Palms meet or stay wide.,[C] Exhale & Lower (GROUND) Breathe out for 6 counts as arms float back down. Feel the chest and ribcage expand on the inhale. 6 full cycles.
301,Legs Up the Wall,"Passive inversion, 2–3 minutes","Lying on your back, scooted close to a wall.","[A] Setup (SETUP) Sit sideways against the wall, then swing legs up. Hips as close to the wall as comfortable. Arms out at sides, palms up.",[B] Hold & Breathe (RESTORE) Let gravity drain the legs. Close the eyes. Breathe naturally. This posture reverses venous pooling and calms the nervous system.,
302,Reclined Butterfly,"Supine bound angle, hips open","Lying on your back, soles of feet together.",[A] Soles Together (SETUP) Lie on back. Bring the soles of your feet together and let knees fall wide. Place hands on belly or out at sides.,[B] Gravity Hold (RELEASE) Let the inner thighs and groin soften completely. Do not push. Hold 60–90s.,
303,Knees to Chest Rock,Gentle lumbar massage,"Lying on your back, knees hugged to chest.",[A] Hug Knees (SETUP) Lie on back. Hug both knees to chest. Interlock fingers over shins.,[B] Rock Side to Side (MASSAGE) Rock gently left and right. Let the lower back release against the floor. 10–15 slow rocks.,
304,Supine Twist,"Extended hold, both sides","Lying on your back, one knee drawn to chest.","[A] Setup (SETUP) Lie on back. Draw right knee to chest. Arms in a T, shoulders grounded.",[B] Cross Right (TWIST) Guide right knee across to the left with left hand. Turn gaze right. Hold for 45–60s.,[C] Cross Left (TWIST) Return through center. Draw left knee across right. Gaze left. Hold another 45–60s.
305,4-7-8 Breath,Parasympathetic activation,Seated comfortably or lying down.,"[A] Comfortable Position (SETUP) Lie flat or sit upright. Eyes closed. Place one hand on the chest, one on the belly.",[B] Inhale 4 (INHALE) Breathe in through the nose for 4 slow counts. Feel the belly rise before the chest.,"[C] Hold 7, Exhale 8 (EXHALE) Hold for 7 counts. Exhale completely through the mouth for 8 counts. Repeat 4–6 cycles."
401,Standing Chest Opener,Hands clasped behind back,Standing upright.,[A] Stand Tall (SETUP) Stand away from your chair. Feet hip-width. Interlace fingers behind your back.,"[B] Open & Lift (STRETCH) Straighten arms, draw shoulder blades together, lift hands slightly. Open chest toward ceiling. Hold 20–30s.",
402,Chin Tucks,Cervical retractions,"Seated upright in a chair, eyes level.",[A] Neutral Head (SETUP) Sit or stand tall. Eyes level. Shoulders relaxed.,[B] Retract (CERVICAL) Draw chin straight back — not down. Create a slight double chin. Hold 2s. 10 reps.,
403,Thoracic Rotations,"Seated, hands behind head","Seated in a chair, hands behind your head.",[A] Sit Tall (SETUP) Sit at edge of chair. Feet flat. Interlace hands behind head. Elbows wide. Spine long.,[B] Rotate Right (THORACIC) Rotate upper body to the right — elbows leading. Keep hips square. Hold 2s at end range.,"[C] Rotate Left (THORACIC) Return through center, rotate left. Equal range each side. The rotation comes from the mid-back, not the neck."
404,Standing Hip Flexor Stretch,"Kneeling lunge, 30s each side","Standing, about to step into a lunge.","[A] Half Kneel (SETUP) Kneel on right knee, left foot forward. Hips square. Hands on left thigh for support.",[B] Shift Forward (STRETCH) Gently shift weight forward until you feel a stretch in the right hip flexor. Keep torso upright. Hold 30s each side.,
405,Wrist & Forearm Release,"Both directions, 30s each","Standing or seated, one arm extended in front of you.","[A] Extend Arm (SETUP) Extend one arm forward, palm facing down. Use other hand to gently pull fingers back toward you.","[B] Flex Stretch (FOREARM) Hold 15–20s. Feel the forearm extensors lengthen. Reverse — palm up, pull fingers down. Hold 15–20s. Switch arms.",
406,Neck Side Tilts,"Gravity only, 20s each side","Seated or standing upright, shoulders relaxed.",[A] Sit Tall (SETUP) Sit at edge of chair. Spine long. Shoulders down and relaxed.,[B] Drop Right (STRETCH) Let right ear fall toward right shoulder. Gravity only — no forcing. Left shoulder stays grounded. 20s.,[C] Drop Left (STRETCH) Return through center. Drop left ear. 20s. Return slowly.
501,Chin Tucks,"Cervical retraction, 10 reps","Seated upright, eyes level with the horizon.",[A] Sit or Stand Tall (SETUP) Eyes level with horizon. Shoulders relaxed down. Jaw soft. This is the single most important correction for forward head posture.,[B] Retract (CERVICAL) Draw chin straight back — not down. Create a slight double chin. Hold 2s. Feel a stretch at the base of the skull. Release slowly. 10 reps.,
502,Neck Side Tilt,"Gravity only, 30s each side","Seated upright, shoulders relaxed and level.",[A] Sit Tall (SETUP) Sit or stand. Spine long. Shoulders relaxed down away from ears. Eyes forward.,[B] Right Ear Down (STRETCH) Let the right ear fall toward the right shoulder. Do not force — use gravity only. Hold 30s. Left shoulder stays down.,"[C] Left Ear Down (STRETCH) Return through center, drop left ear. Hold 30s. For deeper release, rest hand lightly on top of head — do not pull."
503,Levator Scapulae Stretch,"Corner neck stretch, 30s each","Seated, one hand anchoring the shoulder down.",[A] Turn & Tilt (SETUP) Turn head 45° to the right and tilt chin toward the right armpit. Feel the stretch from the base of the skull toward the left shoulder blade.,"[B] Add Weight (DEEPEN) Rest the right hand gently on the back of the head — do not pull. Hold 30s. Switch sides. This targets the levator scapulae, the most screen-tension muscle.",
504,Upper Trap Release,"Seated hand hold, 30s each","Seated, one hand holding the seat edge for traction.",[A] Anchor Shoulder (SETUP) Sit on right hand to anchor the right shoulder down. Sit tall. This prevents the shoulder from shrugging up and reduces the stretch.,"[B] Lean Left (STRETCH) With right shoulder anchored, slowly tilt the head to the left and slightly forward. Feel the right upper trap lengthen. Hold 30s. Switch.",
