id,name,subtitle,start_setup,step_1,step_2,step_3
505,Thread the Needle,Thoracic rotation from tabletop,"On all fours — hands under shoulders, knees under hips.","[A] Tabletop (SETUP) Hands under shoulders, knees under hips. Spine neutral. Take a breath before moving.",[B] Thread Right (ROTATE) Slide right arm along the floor under the left arm. Right shoulder and ear rest on floor. Hold 30s. Feel the mid-back open.,[C] Thread Left (ROTATE) Return to tabletop. Left arm threads under right. Hold 30s each side. This releases the thoracic spine that screen time locks up.
506,Eagle Arms,"Shoulder blade separation, 30s each","Seated or standing upright, arms at your sides.",[A] Cross Arms (SETUP) Sit or stand tall. Cross right arm over left at the elbows. Wrap forearms and try to bring palms together.,[B] Lift & Hold (STRETCH) Lift elbows to shoulder height. Feel the space between the shoulder blades open. Hold 30s. Switch arm cross. Targets the rhomboids.,
507,Chest Opener with Clasp,"Behind-back retraction, 30s","Standing upright, hands clasped behind your back.",[A] Clasp Behind (SETUP) Stand tall. Interlace fingers behind the back. Straighten arms. Draw shoulder blades together gently.,[B] Lift & Open (EXPAND) Lift clasped hands slightly away from the body. Open the chest. Chin slightly up. Hold 30s. This directly counters the forward curl of screen posture.,
601,90/90 Hip Stretch,"Both sides, 60s each","Seated on the floor, both knees bent at 90°.","[A] Sit to Floor (SETUP) Sit on the floor. Right leg bent in front at 90°, knee and ankle on the ground. Left leg bent behind at 90°. Both shins parallel.",[B] Sit Tall Over Front Leg (INTERNAL) Sit upright over the front (right) shin. Feel the external rotation of the right hip. Press the right knee gently toward the floor. Hold 60s.,[C] Hinge Forward (DEEPEN) Hinge at the hips and walk hands forward over the front shin. Keep spine long — do not round. Hold 30s additional. Switch sides.
602,Kneeling Hip Flexor Stretch,"Low lunge, 60s each side","In a half-kneeling lunge, one knee on the floor.","[A] Half Kneel (SETUP) Kneel on right knee, left foot forward. Hips square. Stack left knee over left ankle. Place hands on left thigh.",[B] Shift & Tuck (STRETCH) Shift hips forward until you feel a deep stretch in the right hip flexor and front of the right thigh. Tuck the pelvis slightly under — do not arch the lower back.,[C] Arm Reach (DEEPEN) Reach right arm overhead and lean slightly left. This lengthens the hip flexor through the full chain to the ribcage. Hold 60s. Switch sides.
603,Pigeon Pose,"Supported, 90s each side","On the floor, front shin angled across the body.","[A] Setup (SETUP) From tabletop, slide right knee forward behind right wrist. Extend left leg straight back. Right ankle moves toward left hip — the sharper the angle, the more intense. Important: the stretch should always be felt in the outer hip, never in the knee. If you feel any sensation in the knee joint, back the ankle closer to your body.",[B] Square Hips (ALIGN) Place a folded blanket or block under the right glute if the hip doesn't reach the floor. Hips stay as square as possible — do not let the pelvis tilt to one side.,[C] Fold Forward (RELEASE) Walk hands forward and lower chest toward the floor. Rest on forearms or forehead. Let the right hip surrender completely. Breathe into the outer right hip. Hold 90s.
604,Supine Figure Four,"Piriformis release, 60s each","Lying on your back, knees bent, feet flat.","[A] Setup (SETUP) Lie on back, knees bent, feet flat. Cross right ankle over left knee. Flex the right foot to protect the knee joint.",[B] Draw In (STRETCH) Clasp hands behind left thigh and draw both legs toward chest. Feel the stretch deep in the right outer hip and glute. This targets the piriformis — the primary sciatic nerve compressor.,[C] Rock Gently (RELEASE) Rock slowly left and right to find the deepest point of tension. Hold 60s. Switch sides. Do not pull aggressively — let the muscle release on its own timeline.
605,Butterfly Stretch,"Soles together, gravity hold","Seated on the floor, soles of feet together.","[A] Sit Tall (SETUP) Sit on the floor. Bring soles of feet together, letting knees fall wide. Hold feet with both hands. Sit on a folded blanket if the lower back rounds.",[B] Let Knees Drop (ADDUCTORS) Do not press the knees down. Let gravity do the work. The inner thighs and groin will release over time — not through force. Hold 60s.,"[C] Hinge Forward (DEEPEN) Hinge forward at the hips — spine long, not rounded. Walk hands forward. Feel the inner groin deepen. Hold 30s. Return upright slowly."
606,Lateral Hip Opener,"Side-lying stretch, 45s each","Lying on your side, legs stacked.","[A] Side Lie (SETUP) Lie on your right side. Right arm extended, right ear resting on it. Stack hips and shoulders. Both knees bent at 90°.","[B] Open Top Knee (ABDUCTOR) Keeping feet together, lift the left knee toward the ceiling like a clamshell opening. Do not let the pelvis roll back. Hold at the top 2s.","[C] Hip Circle (MOBILIZE) From open, draw a slow circle with the left knee — forward, down, back, up. 5 circles each direction. Feel the femoral head moving freely in the socket. Switch sides."
607,Standing Hip Circles,"Full rotation, both directions","Standing, feet hip-width, hands on hips.",[A] Stand Tall (SETUP) Feet hip-width. Hands on hips. Soft knees. Eyes forward or closed. This is the integration movement — done last to bring range into a standing pattern.,"[B] Slow Circles (MOBILIZE) Make large, slow circles with the pelvis — forward, right, back, left. Exaggerate the range in each direction. 8 circles clockwise.","[C] Reverse (MOBILIZE) 8 circles counter-clockwise. Move deliberately through any stiff points rather than skipping past them. The goal is a smooth, continuous arc."
701,Knee Hugs,"Lumbar decompression, 60s",Lying on your back.,[A] Flat on Back (SETUP) Lie on your back. Let the whole body be heavy. Take two slow breaths before moving — this releases baseline tension before you begin.,[B] Hug Both Knees (DECOMPRESS) Draw both knees to chest. Wrap arms around shins. Rock gently side to side. Feel the lower back lengthen and release against the floor.,[C] Hold Still (RELEASE) Find the position of most ease and hold completely still. Breathe into the lower back. Feel the lumbar vertebrae gently separate with each inhale. 60s total.
702,Supine Pelvic Tilts,Supine posterior/anterior tilt,"Lying on your back, knees bent, feet flat.",[A] Lie on Back (SETUP) Small natural arch in lower back — this is neutral. Arms flat at sides. Do not flatten the back before you begin.,[B] Posterior Tilt (CORE) Gently press the lower back into the floor by engaging the deep abdominals. Hold 2s. The movement is subtle — this is not a crunch.,[C] Return to Neutral (RELEASE) Let the arch return. Move slowly and smoothly between positions. This re-educates the muscles that stabilise the lumbar spine.
703,Cat–Cow,"Slow and segmental, 10 cycles","On all fours — hands under shoulders, knees under hips.",[A] Neutral Tabletop (SETUP) Spine neutral. Take one full breath here before moving. This is the most therapeutic movement for the lumbar spine.,[B] Cat — Exhale (FLEX) Round the spine segment by segment toward the ceiling. Tuck chin and pelvis. Exhale fully. Move slowly — feel each vertebra.,"[C] Cow — Inhale (EXT) Let the belly drop, lift gaze and tailbone gently. Do not compress — open. Inhale fully. 10 slow cycles. Increase the range gradually as the back warms."
704,Child's Pose,"Extended hold, 90s","Kneeling, about to sit back toward your heels.","[A] Kneel Back (SETUP) From tabletop, sit hips back toward heels. Knees hip-width or wider. Toes together. Arms extend forward or rest alongside the body.",[B] Forehead Down (DECOMPRESS) Rest forehead on floor or hands. Let the whole spine lengthen. Breathe into the back body — feel the ribcage expand outward with each inhale.,[C] Side Reach (LATERAL) Walk both hands to the right. Feel the left side of the body lengthen. Hold 30s. Return through center. Walk hands left. Hold 30s. Return.
705,Windshield Wipers,"Slow rotation, 10 reps each","Lying on your back, knees bent, arms in a T.","[A] Supine Setup (SETUP) Knees bent, feet flat and hip-width. Arms in a T, palms down. Shoulders stay grounded throughout.",[B] Lower Right (ROTATE) Let both knees fall slowly to the right — only as far as comfortable. Breathe out. Feel the lumbar spine rotate and release. Shoulders do not lift.,"[C] Lower Left (ROTATE) Sweep knees back through center and lower to the left. Slow, windshield-wiper pace. This is traction for the lumbar vertebrae — gravity does the work."
706,Reclined Spinal Twist,"Extended hold, 60s each side",Lying on your back.,"[A] Setup (SETUP) Lie on back. Draw right knee to chest. Arms in a T, shoulders heavy. This passively rotates the lumbar spine and releases the QL — the deepest lower back muscle.","[B] Cross Right (TWIST) Guide right knee across to the left with left hand. Right arm extends, turn gaze right. Let gravity take the knee toward the floor — do not force it. Hold 60s.",[C] Cross Left (TWIST) Return through center slowly. Draw left knee across to the right. Gaze left. Hold 60s. Equal time each side. The release often comes in the final 20 seconds.
707,Legs Up the Wall,"Passive inversion, 2 minutes","Lying on your back, scooted close to a wall.","[A] Setup (SETUP) Sit sideways against a wall, then swing legs up. Hips as close to the wall as comfortable — it is fine to have a slight bend in the knees.","[B] Settle & Breathe (RESTORE) Let the lower back release toward the floor. Arms out at sides, palms up. Eyes closed. This drains venous pooling from the legs and decompresses the lumbar spine passively.","[C] Stay (RELEASE) Simply remain here. Breathe slowly. Each exhale, let the body get heavier. This is the most restorative position for a fatigued lower back. Two full minutes."
801,Weight Shifts,"Ankle strategy training, standing","Standing, feet hip-width, near a wall for safety.",[A] Neutral Stance (SETUP) Stand feet hip-width. Arms relaxed at sides. Soft knees — never locked. Eyes on a fixed point at eye level.,"[B] Side-to-Side Shifts (ANKLE) Slowly shift your weight to the right until the left foot is nearly unloaded. Pause 2 seconds. Shift left. Use your ankles, not your hips — think of yourself as a pendulum, not a seesaw.","[C] Forward & Back (PROPRIOCEPTION) Shift weight forward toward the balls of your feet, then back toward the heels. Stay within a comfortable range. Feel the floor through your feet — this is your sensory feedback loop."
802,Single-Leg Stance,Vestibular & glute med activation,"Standing near a wall, balanced on one foot.","[A] Stand Tall (SETUP) Stand near a wall or sturdy chair within arm's reach — use it for safety, not support. Find a fixed point at eye level to focus on — this is your visual anchor. Arms at sides or lightly touching the wall.","[B] Lift One Foot (BALANCE) Lift one foot a few inches off the floor. Keep the stance leg slightly bent — never lock the knee. The hip of the lifted leg should drop slightly, which means the standing glute med is working. Hold 20–30 seconds each side.","[C] Eyes Closed Progression (VESTIBULAR) Once stable with eyes open, close them. This removes visual compensation and forces the vestibular and somatosensory systems to do the work. Even 5–10 seconds eyes-closed is a meaningful challenge."
803,Tandem Walking,"Heel-to-toe, narrow base of support",Standing at one end of a clear path.,[A] Starting Position (SETUP) Stand tall. Heel of one foot touching the toes of the other. Find a line on the floor or imagine a tightrope. Arms out at sides for balance assist if needed.,"[B] Walk Forward (BALANCE) Step forward, placing the heel of the leading foot directly against the toes of the back foot. Take 10 slow, deliberate steps forward. Eyes forward — not down at your feet.","[C] Walk Backward (VESTIBULAR) Reverse direction — 10 steps back, toe touching heel. Walking backward is a separate vestibular challenge. Move slowly. This is a clinical tool used in fall prevention programs."
804,Grapevine Walk,"Lateral crossover steps, hip coordination",Standing with space to move laterally.,"[A] Side Start (SETUP) Stand tall, feet together. You will move laterally. Clear enough space for 8–10 sideways steps. Arms out slightly for balance.",[B] Cross & Step (COORDINATE) Step right with the right foot. Cross the left foot in front of the right. Step right again. Cross left foot behind the right. Repeat continuously. The alternating front/back crossover is the key pattern — it requires the brain to sequence hip abductor and adductor firing.,"[C] Reverse Direction (BILATERAL) Lead with the left foot back across the same path. Each direction uses a different motor pattern. Aim for smooth, continuous movement — choppy steps mean the brain is still learning the sequence."
805,Lateral Step-Downs,"Eccentric quad loading, 4-inch step","Standing on a low step or curb, one foot at the edge.","[A] Find Your Step (SETUP) Stand on the edge of a bottom stair, curb, or low stool (4–6 inches high). Stand sideways so one foot is on the edge. The other foot hangs free over the side. Hold a wall lightly for safety — not for support.",[B] Slow Descent (ECCENTRIC) Bend the standing leg to slowly lower the hanging foot toward the floor. Take 3–4 full seconds to descend. The standing knee should track directly over the second toe — not collapsing inward. This slow lowering is the entire point: you are training the quad to control deceleration.,"[C] Return to Top (CONTROL) Before the hanging foot touches the floor, reverse direction and press back to standing. Do not push off the lower foot — all the work comes from the standing leg. Switch sides after all reps."
901,Thoracic Extension,Over chair back — mid-spine mobilization,"Seated in a chair, hands behind your head.","[A] Chair Setup (SETUP) Sit at the edge of a firm chair. Place both hands behind your head, fingers interlaced, supporting the weight of your head. Identify the middle of your back — the thoracic spine, roughly between your shoulder blades. This is the target.",[B] Arch Back (EXTEND) Lean back so the top edge of the chair back contacts your mid-spine. Let the upper back gently arch over the support. Do not extend the lower back or neck — this is a thoracic-only movement. Breathe out as you arch. Feel the front of the chest opening.,[C] Segment & Breathe (MOBILIZE) Hold for 2–3 breaths at each level. Then shift slightly up or down the chair back to target adjacent segments. 3–5 positions across the thoracic spine. Never force — the weight of your head is sufficient traction.
902,Neck CARs,Controlled Articular Rotation — cervical spine,"Seated or standing upright, spine long.","[A] Setup & Brace (SETUP) Sit or stand tall. Pack the shoulders down away from ears. Engage the muscles of the neck lightly — imagine you are trying to make a double chin. This pre-tension is what makes CARs different from a regular neck stretch: the joint moves, the surrounding tissues stay engaged.","[B] The Half-Arc (CARS) Begin by drawing your chin toward your chest. Slowly arc the head to the right — ear toward right shoulder, continuing the arc until the ear moves toward the left shoulder, then chin returns to chest. One full half-arc takes 8–10 seconds. Move as if carving through resistance. Never tilt the head back — the arc travels chin to chest only, never through the back of the neck.","[C] Reverse & Repeat (END-RANGE) At any point where you feel stiffness or reduced range, slow down further and breathe into that position. Do not push through pain or any sharp sensation. Reverse direction for one full arc. 2–3 rotations each direction is sufficient. If you feel dizziness at any point, stop immediately and rest."
903,Shoulder CARs,Controlled Articular Rotation — glenohumeral joint,"Standing, one arm at your side.","[A] Setup & Lock Down (SETUP) Stand tall. Work one arm at a time. Before moving, engage the lat on the working side — imagine trying to crush a walnut in your armpit. This stabilizes the scapula so the ball-and-socket joint does the work, not the whole shoulder blade.","[B] Full Arc Forward (CARS) Keeping the arm straight and under tension, lift it forward and up overhead in a large circle. As it passes overhead, rotate the palm to face behind you, then continue the circle down behind your back as far as your range allows. Move through thick resistance. The entire arc should take 10–12 seconds.","[C] Reverse Arc (END-RANGE) At the limit of your range behind the body, pause and breathe. Reverse the circle — same path, same resistance, same slow pace. Switch arms after 2 full rotations. The shoulder that feels stuck is the one that needs this most."
904,Wrist CARs,Controlled Articular Rotation — radiocarpal joint,"Seated or standing, forearms resting or extended.","[A] Setup (SETUP) Sit or stand. Extend both arms in front at shoulder height. Make loose fists. Engage the forearm muscles lightly — you should feel mild tension in the forearm, not the fingers. This active tension is what makes this therapeutic rather than passive.","[B] Full Rotation (CARS) Slowly rotate both wrists simultaneously through their full available range: flex down, rotate toward the little finger side, extend back, rotate toward the thumb side. One full circle takes 6–8 seconds. Move as if drawing large circles in the air with your knuckles.","[C] Reverse & Isolate (END-RANGE) Reverse direction for equal rotations. If one wrist has less range in a particular direction, slow down there — that is where the synovial fluid is most restricted. 4–5 rotations each direction is a complete set."
905,Hip CARs,Controlled Articular Rotation — hip joint,"Standing, one hand lightly on a wall for balance.",[A] Setup & Stabilize (SETUP) Stand on one leg. Hold a wall lightly with one hand for safety only — not for balance support. Engage the standing glute to keep the pelvis completely still. The entire point of Hip CARs is that the pelvis does not move — only the femur in the hip socket. Squeeze the core before lifting the leg.,"[B] Full Circumduction (CARS) Lift the free knee and begin rotating the hip: knee lifts forward, swings out to the side, extends behind the body, sweeps back to center. One full rotation takes 8–10 seconds. Keep the circle as large as your range allows while the pelvis stays completely still. If the hip hikes or the lower back twists, you have exceeded your available range — make the circle smaller.","[C] Reverse & Switch (END-RANGE) Reverse direction for the same number of rotations. At any restricted point in the arc, slow further and breathe. 2–3 rotations each direction, each side. The hip that feels grinding or clicking is the one that needs the most consistent attention."
906,Ankle CARs,Controlled Articular Rotation — talocrural joint,"Seated or standing, one foot lifted off the floor.","[A] Seated Setup (SETUP) Sit in a chair. Cross one ankle over the opposite knee so the foot is free in the air. Hold the lower leg just above the ankle to stabilize the shin — you want the foot to move, not the whole leg. Engage the muscles of the lower leg lightly.","[B] Full Rotation (CARS) Draw the largest circle possible with your big toe. Move clockwise: point the foot forward, rotate out, flex back, rotate in. Take 5–6 seconds per full rotation. Most people discover significant restriction when moving into dorsiflexion (toes pulled back) — this is the direction that matters most for walking and balance.","[C] Reverse & Switch (END-RANGE) Reverse direction. 4–5 rotations each way per foot. If the ankle feels stiff or crunchy, this is synovial fluid restriction — not a reason to stop, but a reason to go slower and breathe through the range."
907,Adductor Rock-Back,Posterior hip capsule & inner thigh release,"On all fours, one knee wide to the side.","[A] Quadruped Setup (SETUP) Begin on hands and knees. Hands under shoulders, knees under hips. Spine neutral. Extend one leg directly out to the side — keep it straight, toes pointing forward or slightly down. The extended leg forms a 90-degree angle with your body.","[B] Rock Back (STRETCH) Slowly shift your hips back toward your heels, keeping the extended leg in place. You will feel a deep stretch along the inner thigh and the back of the hip on the extended side. Take 3–4 seconds to rock back. Breathe out during the descent. Do not round the lower back.","[C] Rock Forward & Repeat (RELEASE) Rock forward to the starting position. Pause briefly, then rock back again. 8–10 slow repetitions, then switch sides. This movement targets the posterior hip capsule and adductors — two structures that chronic sitting locks into permanent shortening."
1001,Plantar Fascia Stretch,Seated toe extension hold,"Seated in a chair, one foot crossed over the opposite knee.",[A] Seated Setup (SETUP) Sit in a chair. Cross one foot over the opposite knee so the sole faces you. Hold the base of the toes with one hand. This is the windlass mechanism — the same tissue that loads with every walking step.,[B] Extend the Toes (STRETCH) Gently pull all toes back toward the shin until you feel a firm stretch along the arch. You should feel the plantar fascia tighten into a cord-like band. Hold this position — do not bounce. 30 seconds minimum. Research shows this specific stretch reduces morning pain more effectively than calf stretching alone.,"[C] Massage the Arch (RELEASE) While holding the toe extension with one hand, use the thumb of the other hand to apply firm, slow strokes along the arch from heel to ball of foot. 5–6 strokes per set. Switch feet."
1002,Seated Foot Roll,Plantar fascia myofascial release,"Seated in a chair, a ball or bottle under one foot.",[A] Find Your Tool (SETUP) A frozen water bottle is ideal — the cold provides additional anti-inflammatory benefit. A tennis ball or smooth water bottle at room temperature also works. Place it on the floor in front of your chair.,"[B] Roll the Arch (RELEASE) Place the arch of one foot on the bottle. Apply moderate downward pressure — enough to feel it, not enough to cause sharp pain. Slowly roll from the heel to the ball of the foot and back. 30 seconds per foot. Pause on any tender spots for 5–10 seconds rather than rolling through them.","[C] Target the Heel (FASCIAL) Shift pressure toward the heel — specifically the medial tubercle of the calcaneus, where the fascia attaches. This is typically the most sensitive spot. Use lighter pressure here. Slow, sustained pressure is more effective than rolling speed."
1003,Gastroc Stretch,"Standing calf stretch, straight knee","Standing, hands on a wall, one foot stepped back.","[A] Wall Setup (SETUP) Stand facing a wall, hands flat at shoulder height for support. Step one foot back about 18–24 inches, keeping both feet pointing straight forward. The back knee stays completely straight throughout — this targets the gastrocnemius, the larger calf muscle that crosses the knee.","[B] Lunge Forward (STRETCH) Bend the front knee and shift your weight forward until you feel a deep stretch in the calf of the back leg. Keep the back heel firmly on the floor — if it lifts, step the foot closer. Hold for 30–45 seconds. The gastroc is directly connected to the Achilles tendon, which loads the plantar fascia.","[C] Switch & Repeat (BILATERAL) Switch sides. If one side is significantly tighter, spend an extra round there. Tight calves are among the most common contributing factors to plantar fasciitis — they increase load on the fascia with every step."
1004,Soleus Stretch,Bent-knee calf stretch — deeper target,"Standing at a wall, back knee bent, rear heel down.","[A] Wall Setup (SETUP) Same starting position as the Gastroc Stretch — one foot stepped back, hands on wall. But this time, bend the back knee slightly. This small change completely shifts the stretch from the gastrocnemius to the soleus — the deeper, shorter calf muscle that attaches below the knee.","[B] Sink Into It (STRETCH) With the back knee bent, shift weight gently forward. The stretch will feel lower and deeper than the gastroc stretch — closer to the Achilles and heel. Keep the back heel on the floor. Hold 30–45 seconds. The soleus is often the tighter of the two calf muscles and the more overlooked.","[C] Switch Sides (BILATERAL) Repeat on the other side. If you have one-sided plantar fasciitis, pay particular attention to the soleus on that side. This stretch is often prescribed alone for cases where standard calf stretching hasn't helped."
1005,Toe Splay,Intrinsic foot muscle activation,Seated or standing barefoot on a firm surface.,"[A] Seated or Standing (SETUP) Sit or stand barefoot on a firm surface. Place both feet flat on the floor, parallel, hip-width apart. Relax everything from the ankle down — no gripping or curling of toes. Feel the full footprint on the floor.",[B] Spread All Toes (ACTIVATE) Actively spread all five toes as wide apart as possible without lifting the foot. Hold for 2 seconds. Most people discover they cannot independently move their toes much at all — this is normal and is exactly why this exercise exists. The abductor hallucis and the interossei are the target muscles.,"[C] Release & Repeat (CONTROL) Slowly release the spread. Pause 1 second. Repeat. If only some toes move, that is useful information — work with what you have. Over days and weeks, the range and independence improves noticeably."
