id,name,subtitle,start_setup,step_1,step_2,step_3
1006,Arch Doming,Short foot exercise — intrinsic arch activation,"Seated, one foot flat on the floor.","[A] Setup (SETUP) Sit with one foot flat on the floor. The goal is to shorten the foot from heel to ball — creating a dome shape in the arch — without curling the toes. This is called the short foot exercise. It directly activates the flexor digitorum brevis and abductor hallucis, the primary arch-supporting muscles.","[B] Draw Heel to Ball (ACTIVATE) Without lifting the heel or curling the toes, try to drag the ball of the foot toward the heel. The arch should visibly rise. Hold for 3 seconds. This movement is subtle and mentally demanding. If the toes curl, relax them — the arch lift must come from the intrinsic muscles, not the long toe flexors.","[C] Release & Build (PROGRESS) Slowly release the arch. 10 reps per foot. As this becomes easier, progress to performing it standing, then standing on one leg. The short foot exercise is the single most prescribed intrinsic foot strengthening movement in sports PT and orthopedic rehabilitation."
1007,Big Toe Extension,Windlass mechanism mobilization,"Seated, foot flat on the floor.",[A] Seated Setup (SETUP) Sit with foot flat on the floor. Place two fingers lightly under the big toe. The big toe is the most mechanically important digit in walking — its extension during push-off is what tightens the plantar fascia like a winch (the windlass mechanism). Restricted big toe extension is a direct cause of arch strain.,"[B] Lift Only the Big Toe (ISOLATE) Lift only the big toe as high as possible, keeping the other four toes on the floor. Hold for 2 seconds. Then reverse — press the big toe down and lift the other four. This isolation trains the extensor hallucis and establishes independent toe control.","[C] Assisted Extension (MOBILIZE) Using your fingers, gently assist the big toe into full extension — past where it goes on its own. Hold for 5 seconds. This passively mobilizes the first metatarsophalangeal joint and stretches the intrinsic flexors. Restricted range here correlates directly with plantar fasciitis severity."
1008,Eccentric Heel Drops,Alfredson protocol — straight knee,"Standing on the edge of a step, heels hanging off the back.","[A] Step Edge Setup (SETUP) Stand on the edge of a step or curb with both feet, heels hanging off the back. Rise up onto both forefeet to the top position. This is the Alfredson protocol — the most evidence-backed exercise for plantar fasciitis and Achilles tendinopathy. Keep the working knee straight throughout.",[B] Single-Leg Lower (ECCENTRIC) Shift weight to one foot. Slowly lower the heel below the step level — taking a full 3 seconds to descend. You are loading the calf eccentrically: it is contracting while lengthening. This is the specific stimulus that promotes tendon and fascial remodeling. Do not rush.,"[C] Two-Leg Return (RESET) Use both feet to rise back to the top position. Switch the working leg. 15 reps each side. If this is painless, add load over time — a backpack with a book is sufficient. Mild discomfort during the movement is acceptable; sharp pain is not."
1009,Eccentric Soleus Drops,Bent-knee heel drops — deeper calf loading,"Standing on the edge of a step, heels hanging off the back.","[A] Step Edge, Knee Bent (SETUP) Same starting position as Eccentric Heel Drops — on a step edge, heels hanging. But this time, bend the working knee to approximately 30–40 degrees. This simple change shifts the load from the gastrocnemius to the soleus. The soleus attaches below the knee and is the primary load-bearing muscle of the calf during walking.","[B] Slow Descent (ECCENTRIC) Lower the heel slowly on the bent-knee leg — 3 full seconds down. Maintain the same knee angle throughout the descent. Do not let the knee straighten during the lowering phase or you shift back to the gastrocnemius. Feel the load deep in the lower calf, just above the heel.","[C] Two-Leg Return (RESET) Use both feet to return to the top. Switch sides. 15 reps each side. These two eccentric exercises — straight knee and bent knee — together cover the full calf-Achilles-fascia chain. Done consistently 3 days a week, clinical improvement is typically measurable within 6–8 weeks."
1010,Towel Scrunches,Flexor digitorum brevis strengthening,"Seated barefoot, a small towel flat under one foot.",[A] Towel Setup (SETUP) Sit barefoot with a small towel flat on the floor under one foot. The towel should be thin enough that you can feel the floor texture through it. No towel? Use a sock or work on a textured surface — the goal is toe flexion against mild resistance.,"[B] Scrunch & Hold (STRENGTHEN) Curl all five toes to scrunch the towel toward you. Use only the toes — do not slide the whole foot. Hold the scrunch for 2 seconds, then release fully. This targets the flexor digitorum brevis and the lumbricals — the small muscles that support the metatarsal arch, the often-overlooked transverse arch of the foot.","[C] Repeat & Switch (ENDURANCE) Continue for 20 seconds, then switch feet. 3 sets per side. As strength builds, progress to standing on one leg while performing the scrunch — this adds the balance challenge and integrates the intrinsic work into functional loading."
1100,Ankle Pumps & Circles,Circulation — prevents swelling and blood pooling,"Seated in your seat, feet flat on the floor.","[A] Seated Start (SETUP) Sit upright, feet flat on the floor. Lift both feet slightly so heels rest lightly. No need to remove shoes.","[B] Pump Up & Down (CIRCULATE) Flex feet up (toes toward shins) then point down — 20 slow repetitions. This activates the soleus muscle, which acts as a second heart to pump blood back from the legs.","[C] Slow Circles (MOBILIZE) Rotate each ankle in slow, full circles — 10 clockwise, 10 counter-clockwise per foot. Imagine drawing large, smooth circles in the air with your big toe."
1101,Seated Glute Squeezes,Prevents gluteal amnesia from prolonged pressure,"Seated in your seat, feet flat.","[A] Neutral Sit (SETUP) Sit tall, feet flat. No leaning — weight distributed evenly through both sit bones. Shoulders relaxed.",[B] Squeeze & Hold (ACTIVATE) Squeeze both glutes firmly together. Hold for 5 seconds. Breathe normally — do not hold your breath or brace the upper body.,[C] Release & Repeat (RESET) Release completely for 5 seconds. 10 repetitions. Prolonged pressure switches off the glutes over time — this keeps the tissue and motor signal alive.
1102,Seated Cat-Cow,Lubricates intervertebral discs compressed under cabin pressure,"Seated upright in your seat, hands on knees.",[A] Hands on Knees (SETUP) Sit at the front third of your seat. Hands resting on knees. Spine neutral. Take one breath here.,"[B] Arch — Inhale (EXT) Inhale as you arch the low back, lift the chest, and gently look upward. Let the spine extend segmentally from tailbone to neck.","[C] Round — Exhale (FLEX) Exhale fully as you round the spine, tuck the chin, and pull the navel in. Feel each vertebra flex. 8–10 slow cycles."
1103,Peripheral Vision Softening,Down-regulates the nervous system during stress or turbulence,"Seated, eyes open and gaze forward.",[A] Soft Gaze Forward (SETUP) Let your eyes relax and unfocus slightly. Do not look at a screen or read. Allow the gaze to become wide and diffuse.,"[B] Expand Peripheral Awareness (DOWNREGULATE) Without moving your eyes, softly notice the full width of your visual field — the edges of the cabin, movement in your periphery. This is panoramic vision, the same visual state predators use when resting.","[C] Hold & Breathe (CALM) Maintain this soft, wide gaze for 60–90 seconds. Breathe slowly. This activates the parasympathetic nervous system and reduces the threat-detection response that makes turbulence feel dangerous."
1104,Standing Psoas Release,Long-axis stretch for hip flexors shortened during travel,"Standing, about to step into a shallow lunge.",[A] Shallow Lunge (SETUP) Step forward into a shallow lunge — not a deep split. Back knee can be raised or lowered. Both feet point forward. Keep torso upright.,[B] Pelvic Tuck & Lean (STRETCH) Tuck the pelvis slightly (posterior tilt) to flatten the low back. Gently lean the torso toward the front leg. You will feel a deep stretch at the front of the back hip — this is the psoas.,"[C] Hold & Breathe (RELEASE) Hold 30–45 seconds each side. With each exhale, allow the hip to sink a little further. Do not force — the psoas responds to patience, not pressure."
1105,Wall Slides (W to Y),Activates lower trapezius to fix 'luggage shoulder',Standing with your back flat against a wall.,"[A] Wall Contact (SETUP) Stand with head, upper back, and glutes touching the wall. Arms in a W shape — elbows bent, backs of hands against the wall. This is your baseline.","[B] Slide to Y (ACTIVATE) Keeping the backs of hands and elbows touching the wall, slowly slide arms upward until they form a Y overhead. If contact is lost, reduce range. The lower trapezius must fire to keep the shoulder blades down and in.",[C] Slow Return (CONTROL) Lower arms back to W in 3 seconds. Do not shrug or let shoulders elevate. 10 reps. This directly reverses the upper trap dominance that carrying luggage creates.
1106,Open Book Stretch,Restores thoracic rotation — the first thing to lock after travel,"Lying on your side, knees stacked at 90°.",[A] Side-Lying Setup (SETUP) Lie on your side with hips and knees bent to 90°. Stack knees together. Extend both arms forward at shoulder height. Place top hand on top knee to keep hips anchored.,"[B] Open the Top Arm (ROTATE) Keeping the bottom knee stack stable, slowly rotate the top arm up, back, and toward the floor behind you — like opening a book. Let the chest and thoracic spine follow the arm.",[C] Hold & Return (RELEASE) Hold for 3–5 breaths at the end range. Do not force the shoulder to the floor — let gravity do it gradually. Return slowly. 5 reps each side.
1107,Physiological Sigh,Rapidly offloads CO₂ and signals the brain you have arrived safely,Seated or lying down — any comfortable position.,[A] Relax Completely (SETUP) Sit or lie comfortably. Let the body be heavy. Close the eyes. This is not just breathing — it is a signal to the nervous system that the travel phase is over.,"[B] Double Inhale (CO2 OFFLOAD) Breathe in through the nose to about 80% capacity, then sniff in a second short inhale to fully inflate the lungs. This pops collapsed air sacs (alveoli) and maximizes surface area for CO₂ exchange.","[C] Long Exhale (DOWNREGULATE) Release a long, slow exhale through the mouth — twice as long as the inhale. 3–5 rounds. Each cycle measurably reduces physiological arousal. You will feel the nervous system shift."
1108,Doorway Pec Stretch,Counteracts internal shoulder rotation from carrying bags,"Standing in a doorway, forearms on the frame.","[A] Doorway Setup (SETUP) Stand in a doorway. Place both forearms on the door frame at 90° — elbows at shoulder height, upper arms parallel to floor. Step one foot forward.",[B] Lean Through (STRETCH) Gently shift your weight forward through the doorway. Let the chest open. You should feel a stretch across the pectorals and front of the shoulders.,"[C] Hold & Breathe (RELEASE) Hold 30–45 seconds. On each exhale, allow the chest to open a fraction more. Do not shrug the shoulders up. Switch foot position halfway through."
1109,Glute Bridge,Re-engages the posterior chain after hours of sitting,"Lying on your back, knees bent, feet flat on the floor.","[A] Supine Setup (SETUP) Lie on your back. Feet flat, hip-width, heels 6 inches from glutes. Arms flat at sides. This is your reset position after travel.","[B] Drive & Lift (ENGAGE) Press through the heels and lift the hips until shoulders, hips, and knees form a straight line. Squeeze the glutes firmly at the top. Hold 2 seconds.",[C] Lower Slowly (CONTROL) Lower with control — 3 seconds down. Do not let the hips crash. The slow descent builds the posterior chain that sitting disengages.
2000,Thoracic Extension (foam roller),Extension options,Seated or supine with foam roller/rolled towel under the upper back (shoulder blade level).,[A] Setup (SETUP) Place foam roller or rolled towel under upper back. Keep knees bent and feet on the floor if lying.,[B] Extend (EXTEND) Support your head with hands and gently arch back over the roller. Pause and breathe for 3-5 breaths.,"[C] Alternative (VARIATION) If no roller, use a chair back, wall, or puppy-pose quadruped variation to find comfortable extension."
2001,Cat–Cow,Segmental flexion/extension,"On all fours, neutral spine.","[A] Neutral Tabletop (SETUP) Hands under shoulders, knees under hips. Neutral spine, neck long.","[B] Cow — Inhale (EXTEND) Inhale, drop the belly, lift the chest and tailbone.","[C] Cat — Exhale (FLEX) Exhale, round through the spine segment by segment. Move slowly for 10 cycles."
2002,Thoracic Rotation,"Rotation, 5–10 per side",Seated or kneeling with arms crossed.,[A] Seated Setup (SETUP) Sit tall with hands across chest or arms hugging shoulders.,"[B] Rotate (ROTATE) Rotate upper body gently to one side, keeping hips facing forward. Return and repeat other side.",
2003,Wall Angels,Scapular retraction & mobility,Standing with back against a wall.,"[A] Wall Contact (SETUP) Head, upper back and glutes touch the wall. Arms in a W at shoulder height.",[B] Slide to Y (ACTIVATE) Slide arms up overhead into a Y keeping contact with the wall. Return slowly.,
2004,Chin Tucks,Cervical retraction,Seated or standing tall.,"[A] Setup (SETUP) Sit or stand tall, eyes forward.","[B] Tuck (NECK) Draw chin straight back (not down), hold gently for 3–5 seconds then release.",
2005,Thread the Needle,Thoracic rotation & shoulder release,"All fours — hands under shoulders, knees under hips.","[A] Setup (SETUP) From tabletop, reach one arm under the body and rest shoulder on the floor.",[B] Hold (RELEASE) Breathe here 20–30 seconds per side and feel rotation through the upper back.,
2006,Child's Pose,Gentle spine flexion & reset,Kneel and reach arms forward.,[A] Kneel & Fold (SETUP) Sit back toward heels and fold forward with arms extended. Relax the chest toward the floor.,,
2007,Hand on Heart,Self-compassion activation through physical self-touch,"Seated or lying down, in any comfortable position.","[A] Place Both Hands (SETUP) Place one or both hands flat on the center of the chest, over the heart. Close the eyes. Physically feel the warmth of your own hands through the fabric. This simple gesture activates the same neurological pathway as receiving care from another person — the body does not fully distinguish the source of the touch.",[B] Feel the Heartbeat (CONNECT) Press gently until you can feel your heartbeat — or simply feel the rise and fall of the chest with the breath. Acknowledge: this heart has been beating for your entire life without your asking it to. It does not need you to be anxious on its behalf. Let it do its work.,"[C] Breathe Into the Hands (SOFTEN) Breathe slowly, imagining the breath flowing to and from the hands. With each exhale, consciously soften the area beneath the palms. Dr. Kristin Neff's research on self-compassion shows this gesture measurably reduces cortisol and activates the caregiving system — the same system that calms an anxious child also calms an anxious adult."
2008,Earlobe Circles,Auricular vagal branch stimulation through ear massage,"Seated, both hands raised to the ears.","[A] Find the Earlobes (SETUP) Reach up and gently take both earlobes between the thumb and index finger. The ear — specifically the concha and tragus — contains a branch of the vagus nerve called the auricular branch. Gentle stimulation here has been shown in clinical studies to increase heart rate variability, a direct marker of parasympathetic tone.","[B] Slow Circles and Gentle Pulls (STIMULATE) Make slow, gentle circles with the earlobes. Then gently pull the lobes downward — a slow, steady traction. Move to the outer ear rim (helix) and trace it slowly from bottom to top with the thumb. Take your time. This is not massage — it is gentle, deliberate stimulation.","[C] Continue and Breathe (TONE) Continue for the full minute, working both ears simultaneously. Breathe slowly — long exhales enhance the effect. You may notice a warmth in the ears, a softening of tension in the jaw, or a gentle heaviness behind the eyes. These are signs of vagal activation. This technique is used in integrative medicine for acute anxiety and insomnia."
2010,Wrist Flexor Stretch,Stretch the palm-side forearm,"Seated or standing, arm extended.",[A] Setup (SETUP) Extend the arm with palm facing up.,[B] Stretch (STRETCH) Use the other hand to gently pull fingers back toward you. Hold 30s per side.,
2011,Wrist Extensor Stretch,Stretch the top forearm,Arm extended palm down.,[A] Setup (SETUP) Extend the arm with palm facing down.,[B] Stretch (STRETCH) Use the other hand to press the fingers toward the forearm. Hold 30s per side.,
2012,Median Nerve Glide,Nerve mobility,"Seated, arm supported.",[A] Setup (SETUP) Start with a neutral wrist and fingers.,"[B] Glide (GLIDE) Make a fist, then straighten fingers and thumb across the palm. Repeat smoothly for 10 reps.",
2013,Prayer Stretch,Gentle wrist flexion,Standing or seated at chest height.,"[A] Prayer Setup (SETUP) Bring palms together at chest, fingers pointing up.",[B] Lower (STRETCH) Slowly lower hands while keeping palms together to stretch the wrists. Hold 20s.,
2014,Shakeout & Fist Pumps,Loosen the hands and forearms,Standing or seated.,[A] Shake (RELEASE) Shake both hands loose for 15 seconds.,[B] Fist Pumps (ACTIVATE) Alternate making a fist and opening the hand with punch-like pumps for 15 seconds.,
2101,Progressive Muscle Relaxation,Systematic tension-release that discharges stored muscular stress,"Lying on your back on the floor or a firm surface, arms at sides.","[A] Feet, Calves & Thighs (LOWER BODY) Starting at the feet: curl the toes and tense the feet hard for 5 seconds, then release completely. Next, contract the calves and thighs simultaneously — hold 5 seconds, then let go. The contrast between maximal tension and release is the mechanism. Stress stores muscular holding patterns below conscious awareness; PMR makes them visible and clears them.","[B] Core, Hands & Arms (MID BODY) Tense the glutes and core together — hold 5 seconds, release. Then make tight fists and tense the forearms, biceps, and shoulders all at once — hold 5 seconds, release fully. Let the arms go completely heavy. Notice the warmth in the released muscles — this is increased blood flow returning.","[C] Shoulders, Jaw & Face (UPPER BODY) Shrug the shoulders to the ears — hold 5 seconds, release. Clench the jaw and scrunch the face — hold 5 seconds, release. Finally, take a full breath, tense the entire body from feet to face simultaneously — hold 5 seconds, then release everything at once and exhale fully. One complete cycle is enough; repeat if time allows."
2102,Rhythmic Walking,Bilateral gait cycle that metabolizes cortisol and adrenaline,"Standing, with enough space to walk or march in place.","[A] March in Place (SETUP) Begin marching — knees lifting high, arms swinging in opposition (right arm forward as left knee rises). The gait cycle is the body's natural stress-metabolism mechanism. Research shows a brisk 10-minute walk reduces cortisol by 15–20%. Even 2 minutes of deliberate marching initiates this response.","[B] Cross-Body Pattern (BILATERAL) Exaggerate the cross-body swing: right elbow drives back as the left knee lifts, and vice versa. This bilateral, alternating pattern activates both brain hemispheres simultaneously and has a measurable organizing effect on a dysregulated nervous system — the same mechanism that makes walking after an argument feel instinctively helpful.","[C] Audible Exhale with Each Step (DISCHARGE) Breathe out with each step — a short, deliberate exhale through the mouth, like punctuation. Make it audible. Lift the knees higher, let the arms swing wider. After 2 minutes you will notice a shift: the quality of mental activity changes. Stress rumination is harder to sustain when the body is engaged bilaterally."
2103,Thoracic Extension,"Opens the chest compressed by stress posture, restores full breathing","Seated in a firm chair, hands clasped behind the head.","[A] Hands Behind Head (SETUP) Sit at the edge of a firm chair. Interlace the fingers behind the head, elbows wide. Chronic stress collapses the chest inward and forward — shoulders round, the thoracic spine flexes, and the breath shortens. This position is the direct reversal of that pattern.","[B] Extend Over the Chair Back (OPEN) Lean back gently over the top edge of the chair back — let it act as a fulcrum for the mid-thoracic spine. Allow the head to drop back, elbows flare open, chest lifts toward the ceiling. Hold 10–15 seconds. Breathe into the stretch. You may feel or hear gentle cracking — this is normal joint cavitation.","[C] Repeat at Different Levels (MOBILIZE) Come up slowly, shift position up slightly on the chair, and extend again at a different vertebral level. 3–4 extensions across the mid and upper thoracic. Each one opens the anterior chest, stretches the intercostals, and restores full lung volume — all of which are mechanically restricted during the stress posture."
2104,The Shake-Out,TRE — Tension/Trauma Releasing Exercises via natural tremor,"Standing, feet hip-width, knees soft.","[A] Soft Knees, Begin Bouncing (SETUP) Stand with feet hip-width, knees softly bent. Let the arms hang completely loose. Begin gentle heel-drops — heels barely lifting, dropping with gravity, letting the body bounce passively. Do not force anything. Animals in the wild tremble after a stressful encounter to discharge the activation; this is the same reflex.","[B] Let the Shake Travel Up (DISCHARGE) Let the tremoring move up from the feet — through the knees, hips, belly, chest, arms. If the body wants to shake more, let it. If natural tremor doesn't arrive, gentle deliberate bouncing is still effective. The goal is movement without muscular control — surrendering the body to its own discharge mechanism.","[C] Gradually Still, Then Rest (INTEGRATE) After 90 seconds, let the shaking slow naturally — do not stop it abruptly. Stand completely still for 20 seconds and notice the quality of the body: warmth, tingling, a sense of weight and softness. This is parasympathetic activation. Used in trauma-informed therapy worldwide (TRE, Somatic Experiencing)."
2105,Child's Pose,Vagal toning through forward fold and abdominal compression,"Kneeling on the floor, knees wide, big toes together.","[A] Kneel and Fold Forward (SETUP) Kneel with knees wide or together, big toes touching. Fold the torso forward over the thighs and rest the forehead on the floor, or on stacked hands or a folded blanket. Arms can extend forward or rest alongside the body. Let the entire torso go heavy.",[B] Abdomen Against Thighs (COMPRESS) The mild compression of the abdomen against the thighs in this position applies gentle pressure on the gut wall — which in turn stimulates the vagus nerve via the enteric nervous system. This is part of why forward folds feel intrinsically calming. Allow each exhale to press the belly more firmly against the thighs.,"[C] Breathe Into the Back Body (RESTORE) Direct the breath into the back: feel the ribs widen laterally on the inhale, then settle on the exhale. Stay for the full 90 seconds. If the mind returns to the stressor, acknowledge it and redirect to the sensation of the forehead on the ground. You do not have to solve anything right now."
2106,Chin Tucks,Cervical decompression that releases the suboccipital muscles,Seated upright or standing against a wall.,"[A] Upright Posture (SETUP) Sit or stand tall. During stress, the head juts forward as the body prepares for action — this compresses the upper cervical spine, restricts blood flow to the brain, and contributes to tension headaches. The chin tuck is a direct reset of this pattern. Think: 'tall spine, double chin.'","[B] Draw the Chin Straight Back (RETRACT) Without tilting the head, draw the chin straight back — creating a 'double chin.' The head should feel like it's gliding back on a level track, not tucking downward. Hold the retraction gently for 3–5 seconds. You should feel a mild stretch at the base of the skull — this is the suboccipital release.","[C] 10 Slow Reps (DECOMPRESS) Release and repeat — 10 slow, deliberate reps. Each one creates traction in the upper cervical joints, decompresses the C1-C2 region, and releases the muscles that clamp tight under stress. Combined with slow nasal breathing throughout, this produces a rapid drop in perceived tension."
